{
  "capabilities": [
    {
      "authority": {
        "networkAccess": false,
        "spawnsSubprocess": true,
        "writesFilesystem": false
      },
      "commands": [
        "./pollux list-entities --json",
        "./pollux list-templates --json",
        "./pollux list-skeletons --json",
        "./pollux describe-skeleton <name> --json",
        "./pollux describe <entity> --json",
        "./pollux doctor --json",
        "./pollux check-generated --workspace=<path>"
      ],
      "description": "Read-only discovery of repositories, generator surfaces, skeleton provenance, targets, support status, and required resource IDs.",
      "environment": ["node >= 20", "git"],
      "failureCodes": [
        "WORKFLOW_PRECONDITION_FAILED",
        "CAPABILITY_UNSUPPORTED",
        "PATH_UNSAFE"
      ],
      "frameworkTargets": [
        "start-ui-vite",
        "nextjs",
        "react-router",
        "astro",
        "tanstack-start"
      ],
      "generatorSurfaces": [
        "manager",
        "generated",
        "generated-server",
        "go-backend",
        "standalone"
      ],
      "id": "pollux.inspect",
      "minSupportStatus": "reference-only",
      "mode": "inspect",
      "postconditions": [
        "no filesystem writes",
        "structured proposed operation with exact affected paths"
      ],
      "preconditions": [
        "running inside a checkout that contains the ./pollux CLI"
      ],
      "resources": [
        "generator.pollux-cli",
        "templates.legacy-typescript",
        "templates.go-backend",
        "templates.standalone-shared",
        "layout.start-ui-vite",
        "design.tokens"
      ],
      "skills": ["pollux-inspect"]
    },
    {
      "authority": {
        "networkAccess": false,
        "spawnsSubprocess": true,
        "writesFilesystem": true
      },
      "commands": [
        "./pollux list-entities --json",
        "./pollux validate <entity> [--metadata-dir=<dir>]",
        "./pollux plan --workspace=<path> --entity=<name> [--metadata-dir=<dir>] --json"
      ],
      "description": "Author new Pollux entity metadata (json-files/<entity>.json) from a brief description of the intended app entity, validate it, and prepare it for generation.",
      "environment": ["node >= 20"],
      "failureCodes": [
        "WORKFLOW_PRECONDITION_FAILED",
        "PLAN_INVALID",
        "PATH_UNSAFE"
      ],
      "frameworkTargets": [
        "start-ui-vite",
        "nextjs",
        "react-router",
        "astro",
        "tanstack-start"
      ],
      "generatorSurfaces": [
        "manager",
        "generated",
        "generated-server",
        "go-backend",
        "standalone"
      ],
      "id": "pollux.entity.author",
      "minSupportStatus": "experimental",
      "mode": "create",
      "postconditions": [
        "metadata file passes ./pollux validate with zero errors",
        "assumptions inferred from the brief are reported explicitly",
        "bundled-generator mode: metadata written to the user's project (pollux-metadata/), never into the plugin cache"
      ],
      "preconditions": [
        "running inside a checkout that contains the ./pollux CLI and json-files/",
        "entity name does not already exist (or explicit confirmation to edit)"
      ],
      "resources": ["generator.pollux-cli", "reference.pollux-kb"],
      "skills": ["pollux-author-entity"]
    },
    {
      "authority": {
        "networkAccess": false,
        "spawnsSubprocess": true,
        "writesFilesystem": true
      },
      "commands": [
        "./pollux list-skeletons --json",
        "./pollux describe-skeleton <name> --json",
        "./pollux new-workspace <skeleton> --dir=<path> [--name=<pkg>]"
      ],
      "description": "Create a fresh application workspace from a registered boilerplate skeleton through staged, atomic copy with provenance.",
      "environment": ["node >= 20", "pnpm"],
      "failureCodes": [
        "SKELETON_UNKNOWN",
        "DESTINATION_NOT_EMPTY",
        "PACKAGE_NAME_INVALID",
        "WORKFLOW_PRECONDITION_FAILED",
        "PATH_UNSAFE"
      ],
      "frameworkTargets": ["nextjs", "react-router", "astro", "tanstack-start"],
      "generatorSurfaces": ["standalone"],
      "id": "pollux.workspace.create",
      "minSupportStatus": "experimental",
      "mode": "create",
      "postconditions": [
        ".pollux/workspace.json provenance exists",
        "install and verification commands reported",
        "database infra provisioned automatically: docker-compose.yml with pgvector/pgvector:pg17, initdb vector extension, DATABASE_URL in .env.example (unless explicitly declined)"
      ],
      "preconditions": [
        "explicit user request naming skeleton and destination",
        "destination is empty or does not exist",
        "skeleton status is boilerplate (not reference-only)"
      ],
      "resources": [
        "generator.pollux-cli",
        "layout.nextjs",
        "layout.react-router",
        "layout.astro",
        "layout.tanstack-start",
        "design.tokens"
      ],
      "skills": ["pollux-create-workspace"]
    },
    {
      "authority": {
        "networkAccess": false,
        "spawnsSubprocess": true,
        "writesFilesystem": true
      },
      "commands": [
        "./pollux describe-skeleton <name> --json",
        "./pollux validate-skeletons"
      ],
      "description": "Apply or port a Pollux admin shell (sidebar, topbar, tokens, content canvas) into a supported framework target.",
      "environment": ["node >= 20", "pnpm"],
      "failureCodes": [
        "TARGET_EXPERIMENTAL",
        "CAPABILITY_UNSUPPORTED",
        "PATH_UNSAFE",
        "WORKFLOW_PRECONDITION_FAILED",
        "VERIFICATION_FAILED"
      ],
      "frameworkTargets": [
        "start-ui-vite",
        "nextjs",
        "react-router",
        "astro",
        "tanstack-start"
      ],
      "generatorSurfaces": ["manager", "standalone"],
      "id": "pollux.layout.apply",
      "minSupportStatus": "experimental",
      "mode": "modify",
      "postconditions": [
        "light/dark themes verified after reload",
        "responsive shell, keyboard navigation, and target build verified",
        "no framework-crossing imports"
      ],
      "preconditions": [
        "explicit user request with exact target",
        "target layout resource is packaged and hash-verified",
        "affected files classified as handwritten-host, generator-owned, or generated"
      ],
      "resources": [
        "layout.start-ui-vite",
        "layout.nextjs",
        "layout.react-router",
        "layout.astro",
        "layout.tanstack-start",
        "design.tokens"
      ],
      "skills": ["pollux-apply-layout"]
    },
    {
      "authority": {
        "networkAccess": false,
        "spawnsSubprocess": true,
        "writesFilesystem": true
      },
      "commands": [
        "./pollux validate [entity...]",
        "./pollux gen-entity <entity> [--groups=..] [--renderer=go|node]",
        "./pollux gen-all [--renderer=go|node]",
        "./pollux gen-backend --backend=typescript|go",
        "./pollux fmt",
        "./pollux check",
        "./pollux plan --workspace=<path> --entity=<name> --json",
        "./pollux generate --workspace=<path> --entity=<name> | --all"
      ],
      "description": "Regenerate legacy TypeScript pages, standalone Go backend, or standalone framework CRUD from json-files metadata through the canonical Pollux CLI.",
      "environment": ["node >= 20", "pnpm", "gohygen (go backend only)"],
      "failureCodes": [
        "PLAN_INVALID",
        "TARGET_UNSUPPORTED",
        "TARGET_MISMATCH",
        "OWNERSHIP_CONFLICT",
        "GENERATED_EDITED",
        "GENERATED_PATH_DIRTY",
        "WORKFLOW_PRECONDITION_FAILED",
        "VERIFICATION_FAILED"
      ],
      "frameworkTargets": [
        "start-ui-vite",
        "nextjs",
        "react-router",
        "astro",
        "tanstack-start"
      ],
      "generatorSurfaces": [
        "generated",
        "generated-server",
        "go-backend",
        "standalone"
      ],
      "id": "pollux.crud.generate",
      "minSupportStatus": "supported",
      "mode": "modify",
      "postconditions": [
        "canonical fmt pipeline ran (oxlint --fix, then oxfmt)",
        "drift gate ./pollux check passes",
        "generated ownership manifest updated by the CLI only"
      ],
      "preconditions": [
        "metadata validation passes before writes",
        "explicit backend/target selection; no silent defaults",
        "generated paths are clean or user approved --accept-generated-overwrite for named files"
      ],
      "resources": [
        "generator.pollux-cli",
        "templates.legacy-typescript",
        "templates.go-backend",
        "templates.standalone-shared",
        "templates.target.nextjs",
        "templates.target.react-router",
        "templates.target.astro-react",
        "templates.target.tanstack-start"
      ],
      "skills": ["pollux-generate-crud"]
    },
    {
      "authority": {
        "networkAccess": false,
        "spawnsSubprocess": true,
        "writesFilesystem": false
      },
      "commands": [
        "node plugins/pollux-ui/scripts/validate-package.mjs",
        "node plugins/pollux-ui/scripts/verify-source-drift.mjs",
        "./pollux validate",
        "./pollux test --suite=unit",
        "./pollux test --suite=selection",
        "./pollux test --suite=go",
        "./pollux check",
        "./pollux validate-skeletons",
        "node scripts/pollux/test/workspace-matrix.mjs --target nextjs",
        "node scripts/pollux/test/workspace-matrix.mjs --target remix",
        "node scripts/pollux/test/workspace-matrix.mjs --target astro",
        "node scripts/pollux/test/workspace-matrix.mjs --target tanstack-start"
      ],